{
  "decision": "D-78",
  "actualizado": "2026-10-20",
  "nota": "Lo escribe scripts/sincronizar-bestiario.mjs. desdeSeg es el segundo del máster donde empieza el verso, sacado de LRCLIB (lrclib.net); de ahí no se guarda la letra. Cada recorte vive en public/audio/bestiario/<id>.mp3.",
  "recortes": [
    {
      "id": "la-bestia-pop",
      "tema": "la-bestia-pop",
      "desdeSeg": 44.02,
      "coincidencia": 1,
      "lrclib": 34414816,
      "duracionMasterSeg": 247.1,
      "difDuracionSeg": -0.1
    },
    {
      "id": "el-senor-de-los-cielos",
      "tema": "el-arbol-del-gran-bonete",
      "desdeSeg": 28.56,
      "coincidencia": 1,
      "lrclib": 14647920,
      "duracionMasterSeg": 312.2,
      "difDuracionSeg": 0
    },
    {
      "id": "el-bicho-del-gran-bonete",
      "tema": "el-arbol-del-gran-bonete",
      "desdeSeg": 37.73,
      "coincidencia": 1,
      "lrclib": 14647920,
      "duracionMasterSeg": 312.2,
      "difDuracionSeg": 0
    },
    {
      "id": "el-jocker-burlon",
      "tema": "el-arbol-del-gran-bonete",
      "desdeSeg": 85.28,
      "coincidencia": 0.75,
      "lrclib": 14647920,
      "duracionMasterSeg": 312.2,
      "difDuracionSeg": 0
    },
    {
      "id": "el-monito-que-trepa",
      "tema": "juguetes-perdidos",
      "desdeSeg": 193.49,
      "coincidencia": 1,
      "lrclib": 14647077,
      "duracionMasterSeg": 430.4,
      "difDuracionSeg": 0.1
    },
    {
      "id": "los-pajaros-de-la-noche",
      "tema": "juguetes-perdidos",
      "desdeSeg": 108.68,
      "coincidencia": 1,
      "lrclib": 14647077,
      "duracionMasterSeg": 430.4,
      "difDuracionSeg": 0.1
    },
    {
      "id": "la-lechuza-que-circula",
      "tema": "mariposa-pontiac-rock-del-pais",
      "desdeSeg": 233.91,
      "coincidencia": 1,
      "lrclib": 14647933,
      "duracionMasterSeg": 289.9,
      "difDuracionSeg": 0.1
    },
    {
      "id": "el-angel-de-la-soledad",
      "tema": "un-angel-para-tu-soledad",
      "desdeSeg": 167.56,
      "coincidencia": 1,
      "lrclib": 17901973,
      "duracionMasterSeg": 232.1,
      "difDuracionSeg": 0
    },
    {
      "id": "el-angel-guardian",
      "tema": "la-dicha-no-es-una-cosa-alegre",
      "desdeSeg": 242.88,
      "coincidencia": 1,
      "lrclib": 14645124,
      "duracionMasterSeg": 337.7,
      "difDuracionSeg": 0.1
    },
    {
      "id": "el-angelito-frito",
      "tema": "estas-frito-angelito",
      "desdeSeg": 39.17,
      "coincidencia": 1,
      "lrclib": 20880979,
      "duracionMasterSeg": 274.2,
      "difDuracionSeg": 0
    },
    {
      "id": "el-capitan-buscapina",
      "tema": "las-increibles-andanzas-del-capitan-buscapina-en-cybersiberia",
      "desdeSeg": 48.57,
      "coincidencia": 1,
      "lrclib": 14649361,
      "duracionMasterSeg": 284.5,
      "difDuracionSeg": 0
    },
    {
      "id": "el-rey-garufa",
      "tema": "las-increibles-andanzas-del-capitan-buscapina-en-cybersiberia",
      "desdeSeg": 102,
      "coincidencia": 1,
      "lrclib": 14649361,
      "duracionMasterSeg": 284.5,
      "difDuracionSeg": 0
    },
    {
      "id": "super-walter",
      "tema": "las-increibles-andanzas-del-capitan-buscapina-en-cybersiberia",
      "desdeSeg": 74.94,
      "coincidencia": 1,
      "lrclib": 14649361,
      "duracionMasterSeg": 284.5,
      "difDuracionSeg": 0
    },
    {
      "id": "comboman",
      "tema": "las-increibles-andanzas-del-capitan-buscapina-en-cybersiberia",
      "desdeSeg": 165.9,
      "coincidencia": 1,
      "lrclib": 14649361,
      "duracionMasterSeg": 284.5,
      "difDuracionSeg": 0
    },
    {
      "id": "la-princesita-sapito",
      "tema": "las-increibles-andanzas-del-capitan-buscapina-en-cybersiberia",
      "desdeSeg": 91.42,
      "coincidencia": 1,
      "lrclib": 14649361,
      "duracionMasterSeg": 284.5,
      "difDuracionSeg": 0
    },
    {
      "id": "el-alien-duce",
      "tema": "alien-duce",
      "desdeSeg": 102.66,
      "coincidencia": 1,
      "lrclib": 14648979,
      "duracionMasterSeg": 194.5,
      "difDuracionSeg": 0
    },
    {
      "id": "porco-rex",
      "tema": "alien-duce",
      "desdeSeg": 39.42,
      "coincidencia": 1,
      "lrclib": 14648979,
      "duracionMasterSeg": 194.5,
      "difDuracionSeg": 0
    },
    {
      "id": "el-gavilan",
      "tema": "alien-duce",
      "desdeSeg": 120.21,
      "coincidencia": 1,
      "lrclib": 14648979,
      "duracionMasterSeg": 194.5,
      "difDuracionSeg": 0
    },
    {
      "id": "la-divina-tv-fuhrer",
      "tema": "divina-tv-fuhrer",
      "desdeSeg": 41.47,
      "coincidencia": 1,
      "lrclib": 7257161,
      "duracionMasterSeg": 181.3,
      "difDuracionSeg": -0.3
    },
    {
      "id": "los-buitres-de-la-tele",
      "tema": "estas-frito-angelito",
      "desdeSeg": 56.46,
      "coincidencia": 1,
      "lrclib": 20880979,
      "duracionMasterSeg": 274.2,
      "difDuracionSeg": 0
    },
    {
      "id": "los-camellos-prestigiosos",
      "tema": "estas-frito-angelito",
      "desdeSeg": 128.49,
      "coincidencia": 1,
      "lrclib": 20880979,
      "duracionMasterSeg": 274.2,
      "difDuracionSeg": 0
    },
    {
      "id": "drogocop",
      "tema": "drogocop",
      "desdeSeg": 25.07,
      "coincidencia": 1,
      "lrclib": 23027294,
      "duracionMasterSeg": 186.3,
      "difDuracionSeg": 0
    },
    {
      "id": "las-monjas-verdes",
      "tema": "noticias-de-ayer",
      "desdeSeg": 60,
      "coincidencia": 1,
      "lrclib": 7384175,
      "duracionMasterSeg": 263.5,
      "difDuracionSeg": -0.5
    },
    {
      "id": "momo",
      "tema": "templo-de-momo",
      "desdeSeg": 21.41,
      "coincidencia": 0.89,
      "lrclib": 32350961,
      "duracionMasterSeg": 202,
      "difDuracionSeg": 0
    },
    {
      "id": "el-santo-fumador",
      "tema": "templo-de-momo",
      "desdeSeg": 31.16,
      "coincidencia": 1,
      "lrclib": 32350961,
      "duracionMasterSeg": 202,
      "difDuracionSeg": 0
    },
    {
      "id": "los-gallos-sofocados",
      "tema": "templo-de-momo",
      "desdeSeg": 138.88,
      "coincidencia": 1,
      "lrclib": 32350961,
      "duracionMasterSeg": 202,
      "difDuracionSeg": 0
    },
    {
      "id": "marita-la-virgencita",
      "tema": "murga-de-la-virgencita",
      "desdeSeg": 32.83,
      "coincidencia": 0.83,
      "lrclib": 21224416,
      "duracionMasterSeg": 294.7,
      "difDuracionSeg": 0
    },
    {
      "id": "la-polilla",
      "tema": "murga-de-la-virgencita",
      "desdeSeg": 241.14,
      "coincidencia": 1,
      "lrclib": 21224416,
      "duracionMasterSeg": 294.7,
      "difDuracionSeg": 0
    },
    {
      "id": "la-murga-de-los-renegados",
      "tema": "la-murga-de-los-renegados",
      "desdeSeg": 32.6,
      "coincidencia": 1,
      "lrclib": 14647658,
      "duracionMasterSeg": 287.8,
      "difDuracionSeg": 0.1
    },
    {
      "id": "el-morta",
      "tema": "morta-punto-com",
      "desdeSeg": 19.99,
      "coincidencia": 0.8,
      "lrclib": 30854043,
      "duracionMasterSeg": 195.7,
      "difDuracionSeg": 0.3
    },
    {
      "id": "mister-ed-y-huesito",
      "tema": "lavi-rap",
      "desdeSeg": 73.73,
      "coincidencia": 1,
      "lrclib": 36944049,
      "duracionMasterSeg": 251.6,
      "difDuracionSeg": 0.4
    },
    {
      "id": "el-doctor-saturno",
      "tema": "dr-saturno",
      "desdeSeg": 93.37,
      "coincidencia": 0.8,
      "lrclib": 14645577,
      "duracionMasterSeg": 328.9,
      "difDuracionSeg": 0.1
    },
    {
      "id": "el-sheriff",
      "tema": "sheriff",
      "desdeSeg": 42.38,
      "coincidencia": 1,
      "lrclib": 37106845,
      "duracionMasterSeg": 360.3,
      "difDuracionSeg": -0.3
    },
    {
      "id": "la-bailarina",
      "tema": "ella-baila-con-todos",
      "desdeSeg": 140.15,
      "coincidencia": 1,
      "lrclib": 27800738,
      "duracionMasterSeg": 299.4,
      "difDuracionSeg": -0.4
    },
    {
      "id": "el-pibe-de-los-astilleros",
      "tema": "el-pibe-de-los-astilleros",
      "desdeSeg": 94.12,
      "coincidencia": 1,
      "lrclib": 14746506,
      "duracionMasterSeg": 212.4,
      "difDuracionSeg": 0
    },
    {
      "id": "la-rana-rubia",
      "tema": "el-pibe-de-los-astilleros",
      "desdeSeg": 42.76,
      "coincidencia": 1,
      "lrclib": 14746506,
      "duracionMasterSeg": 212.4,
      "difDuracionSeg": 0
    },
    {
      "id": "la-hija-del-fletero",
      "tema": "la-hija-del-fletero",
      "desdeSeg": 19.81,
      "coincidencia": 1,
      "lrclib": 25166263,
      "duracionMasterSeg": 196.1,
      "difDuracionSeg": 0.1
    },
    {
      "id": "la-gran-lady",
      "tema": "gran-lady",
      "desdeSeg": 35.54,
      "coincidencia": 1,
      "lrclib": 14648555,
      "duracionMasterSeg": 210.8,
      "difDuracionSeg": 0.1
    },
    {
      "id": "la-pequena-novia-del-carioca",
      "tema": "la-pequena-novia-del-carioca",
      "desdeSeg": 39.96,
      "coincidencia": 1,
      "lrclib": 21819494,
      "duracionMasterSeg": 290.6,
      "difDuracionSeg": 0
    },
    {
      "id": "el-botija-rapado",
      "tema": "botija-rapado",
      "desdeSeg": 139.44,
      "coincidencia": 1,
      "lrclib": 7249977,
      "duracionMasterSeg": 168.7,
      "difDuracionSeg": 0.3
    },
    {
      "id": "la-del-lanchon",
      "tema": "tarea-fina",
      "desdeSeg": 77.43,
      "coincidencia": 1,
      "lrclib": 37020328,
      "duracionMasterSeg": 223,
      "difDuracionSeg": 0
    },
    {
      "id": "el-as-del-club-paris",
      "tema": "blues-de-la-artilleria",
      "desdeSeg": 31.48,
      "coincidencia": 1,
      "lrclib": 35754439,
      "duracionMasterSeg": 269.8,
      "difDuracionSeg": 0.2
    },
    {
      "id": "las-almejas",
      "tema": "la-hija-del-fletero",
      "desdeSeg": 137.53,
      "coincidencia": 1,
      "lrclib": 25166263,
      "duracionMasterSeg": 196.1,
      "difDuracionSeg": 0.1
    },
    {
      "id": "el-que-mordio-el-anzuelo",
      "tema": "esa-estrella-era-mi-lujo",